{
  "schema_version": "2.4",
  "task_id": "V25-FINAL-STABLE-ADVERSARIAL",
  "case_id": "V25-FINAL-STABLE",
  "level": "ADVERSARIAL",
  "binding": {
    "repository": "local/GitHub_PR_Review_Harness",
    "reviewed_head_sha": "864ef63404f3b9997ce123a661afdf0a8056efc8"
  },
  "evidence_digest": "44f1e9d285173ac62109c2f32fc696319a21478a65ea5232bec63b87a298432b",
  "reviewer": {
    "node_id": "adversarial-external",
    "model": {
      "family": "configured-independent-reviewer",
      "version": "unconfigured"
    },
    "prompt_digest": "ae9a577caeed234d245ce9537565a548106b28e542ea106ac6c084e621958de7",
    "skill_digest": "0000000000000000000000000000000000000000000000000000000000000000",
    "policy_digest": "37f9e5b7a3ebf94720746c48b2d0b9fa1980d69e285e4c9d12bd795c1cd3907c",
    "standards_digest": "4f53cda18c2baa0c0354bb5f9a3ecbe5ed12ab4d8e11ba873c2f11161202b945",
    "independent_context": true
  },
  "verdict": "PASS",
  "confidence": "high",
  "findings": [],
  "risk_signal": {
    "reversibility": "EASY",
    "blast_radius": "LOCAL",
    "data_sensitivity": "NONE",
    "security_surface": "LOW",
    "availability_criticality": "LOW"
  },
  "escalation": {
    "requested": false,
    "target": "NONE",
    "reasons": [],
    "novel_failure_family": false
  },
  "output_safety": {
    "sanitized": true,
    "external_urls_present": false,
    "markdown_images_present": false,
    "mentions_present": false,
    "secret_scan_passed": true
  },
  "result_digest": "2449fdf6c4239db78d4bcb3dc17b5115a2ef1e28679201c929c77174e10b3ff5"
}
